{
  "schema_version":"project-a-task-policy-v1","id":"A-005","title":"Central logging and audit path","risk":"high","mode":"repo_only","depends_on":["A-004"],
  "allowed_paths":["project-a/terraform/audit/**","project-a/docs/operations/audit-review.md","project-a/docs/architecture/logging.md","project-a/tests/audit/**"],
  "adapter_owned_paths":["evidence/project-a/A-005.json"],"forbidden_operations":["aws","az","terraform apply","terraform destroy","terraform import","terraform plan","log service call","credential read"],
  "validator_mutation_policy":"no_tracked_writes","validators":[{"id":"scope","timeout_seconds":30,"required":true},{"id":"credential_boundary","timeout_seconds":30,"required":true},{"id":"forbidden_operations","timeout_seconds":30,"required":true},{"id":"secret_scan","timeout_seconds":60,"required":true},{"id":"terraform_fmt_check","args":["project-a/terraform/audit"],"timeout_seconds":120,"required":true},{"id":"terraform_validate_offline","args":["project-a/terraform/audit","isolated_tf_data_dir","lockfile_readonly"],"timeout_seconds":300,"required":true},{"id":"audit_semantics","timeout_seconds":180,"required":true},{"id":"docs_links","timeout_seconds":60,"required":true}],
  "terra_attempt_limit":3,"elapsed_limit_minutes":25,"escalation":{"consecutive_failures":2,"same_error_count":2,"no_diff_repairs":1,"scope_escape":true},
  "approval":{"required":true,"gate_id":"H4","stage":"post_validation_pre_commit","approver":"human","receipt_path":".harness/runtime/approvals/A-005.json","reason":"Approve retention, KMS administration, log readers, integrity, and recovery."},
  "expected_artifacts":["project-a/docs/operations/audit-review.md","project-a/docs/architecture/logging.md","project-a/terraform/audit/README.md"],"expected_evidence":"evidence/project-a/A-005.json","commit_message":"feat(A-005): add audit logging baseline","claims":{"cloud_validated":false,"aws_implemented":false,"azure_implemented":false}
}
