{
  "schema_version":"project-a-task-policy-v1","id":"A-003","title":"IAM and policy guardrails","risk":"high","mode":"repo_only","depends_on":["A-002"],
  "allowed_paths":["platform/terraform/identity/**","platform/policies/**","platform/docs/guardrails/iam.md","platform/docs/guardrails/policy-validation.md","platform/tests/iam/**","platform/tests/governance/**"],
  "adapter_owned_paths":["evidence/platform/A-003.json"],"forbidden_operations":["aws","az","terraform apply","terraform destroy","terraform import","terraform plan","policy deployment","credential read"],
  "validator_mutation_policy":"no_tracked_writes","validators":[{"id":"scope","timeout_seconds":30,"required":true},{"id":"credential_boundary","timeout_seconds":30,"required":true},{"id":"forbidden_operations","timeout_seconds":30,"required":true},{"id":"secret_scan","timeout_seconds":60,"required":true},{"id":"terraform_fmt_check","args":["platform/terraform/identity"],"timeout_seconds":120,"required":true},{"id":"terraform_validate_offline","args":["platform/terraform/identity","isolated_tf_data_dir","lockfile_readonly"],"timeout_seconds":300,"required":true},{"id":"iam_policy_semantics","timeout_seconds":180,"required":true},{"id":"iam_negative_tests","timeout_seconds":180,"required":true},{"id":"governance_semantics","timeout_seconds":120,"required":true}],
  "terra_attempt_limit":3,"elapsed_limit_minutes":25,"escalation":{"consecutive_failures":2,"same_error_count":2,"no_diff_repairs":1,"scope_escape":true},
  "approval":{"required":false,"gate_id":null,"stage":"post_validation_pre_commit","approver":"human","receipt_path":null,"reason":"Autonomous repo-only revision; deterministic IAM, governance, and negative-test gates own completion."},
  "expected_artifacts":["platform/docs/guardrails/iam.md","platform/docs/guardrails/policy-validation.md","platform/terraform/identity/README.md","platform/tests/iam/README.md","platform/tests/governance/README.md"],"expected_evidence":"evidence/platform/A-003.json","commit_message":"feat(A-003): add IAM and policy guardrails","claims":{"cloud_validated":false,"aws_implemented":false,"azure_implemented":false}
}
