{
  "schema_version":"project-a-task-policy-v1","id":"A-001","title":"Architecture and backend contract","risk":"high","mode":"repo_only","depends_on":[],
  "allowed_paths":["project-a/README.md","project-a/docs/architecture/**","project-a/docs/decisions/**","project-a/terraform/bootstrap/**","project-a/terraform/examples/foundation/**","project-a/examples/backend/**"],
  "adapter_owned_paths":["evidence/project-a/A-001.json"],"forbidden_operations":["aws","az","terraform apply","terraform destroy","terraform import","terraform plan","cloud login","credential read"],
  "validator_mutation_policy":"no_tracked_writes","validators":[{"id":"scope","timeout_seconds":30,"required":true},{"id":"credential_boundary","timeout_seconds":30,"required":true},{"id":"forbidden_operations","timeout_seconds":30,"required":true},{"id":"secret_scan","timeout_seconds":60,"required":true},{"id":"terraform_fmt_check","args":["project-a/terraform"],"timeout_seconds":120,"required":true},{"id":"terraform_validate_offline","args":["project-a/terraform/bootstrap","isolated_tf_data_dir","lockfile_readonly"],"timeout_seconds":300,"required":true},{"id":"docs_links","timeout_seconds":60,"required":true},{"id":"backend_state_semantics","timeout_seconds":120,"required":true}],
  "terra_attempt_limit":3,"elapsed_limit_minutes":25,"escalation":{"consecutive_failures":2,"same_error_count":2,"no_diff_repairs":1,"scope_escape":true},
  "approval":{"required":true,"gate_id":"H0","stage":"post_validation_pre_commit","approver":"human","receipt_path":".harness/runtime/approvals/A-001.json","reason":"Approve account taxonomy, regions, naming/tags, and state ownership/recovery."},
  "expected_artifacts":["project-a/docs/architecture/overview.md","project-a/docs/decisions/backend.md","project-a/docs/decisions/secrets.md","project-a/terraform/bootstrap/README.md","project-a/examples/backend/nonproduction.hcl","project-a/examples/backend/production.hcl"],"expected_evidence":"evidence/project-a/A-001.json","commit_message":"feat(A-001): define platform architecture contract","claims":{"cloud_validated":false,"aws_implemented":false,"azure_implemented":false}
}
