{
  "schema_version":"project-a-task-policy-v1","id":"A-004","title":"Network boundaries","risk":"high","mode":"repo_only","depends_on":["A-003"],
  "allowed_paths":["project-a/terraform/network/**","project-a/docs/architecture/network.md","project-a/docs/operations/network-failure-cases.md","project-a/docs/diagrams/aws-landing-zone-network.png","project-a/tests/network/**"],
  "adapter_owned_paths":["evidence/project-a/A-004.json"],"forbidden_operations":["aws","az","terraform apply","terraform destroy","terraform import","terraform plan","network connection","credential read"],
  "validator_mutation_policy":"no_tracked_writes","validators":[{"id":"scope","timeout_seconds":30,"required":true},{"id":"credential_boundary","timeout_seconds":30,"required":true},{"id":"forbidden_operations","timeout_seconds":30,"required":true},{"id":"secret_scan","timeout_seconds":60,"required":true},{"id":"terraform_fmt_check","args":["project-a/terraform/network"],"timeout_seconds":120,"required":true},{"id":"terraform_validate_offline","args":["project-a/terraform/network","isolated_tf_data_dir","lockfile_readonly"],"timeout_seconds":300,"required":true},{"id":"network_boundary_semantics","timeout_seconds":180,"required":true},{"id":"network_negative_tests","timeout_seconds":180,"required":true}],
  "terra_attempt_limit":3,"elapsed_limit_minutes":25,"escalation":{"consecutive_failures":2,"same_error_count":2,"no_diff_repairs":1,"scope_escape":true},
  "approval":{"required":false,"gate_id":null,"stage":"post_validation_pre_commit","approver":"human","receipt_path":null,"reason":"Autonomous repo-only revision; deterministic network semantics and negative tests own completion."},
  "expected_artifacts":["project-a/docs/architecture/network.md","project-a/docs/operations/network-failure-cases.md","project-a/docs/diagrams/aws-landing-zone-network.png","project-a/terraform/network/README.md","project-a/tests/network/README.md"],"expected_evidence":"evidence/project-a/A-004.json","commit_message":"feat(A-004): define network boundaries","claims":{"cloud_validated":false,"aws_implemented":false,"azure_implemented":false}
}
