{
  "schema_version":"project-a-task-policy-v1","id":"A-006","title":"Environment compositions and validation","risk":"medium","mode":"repo_only","depends_on":["A-005"],
  "allowed_paths":["platform/environments/**","platform/tests/integration/**","platform/scripts/**","platform/docs/validation.md","platform/docs/operations/baseline-runbook.md","platform/docs/operations/cost-and-teardown.md"],
  "adapter_owned_paths":["evidence/platform/A-006.json"],"forbidden_operations":["aws","az","terraform apply","terraform destroy","terraform import","terraform plan","cloud login","credential read"],
  "validator_mutation_policy":"no_tracked_writes","validators":[{"id":"scope","timeout_seconds":30,"required":true},{"id":"credential_boundary","timeout_seconds":30,"required":true},{"id":"forbidden_operations","timeout_seconds":30,"required":true},{"id":"secret_scan","timeout_seconds":60,"required":true},{"id":"terraform_fmt_check","args":["platform"],"timeout_seconds":180,"required":true},{"id":"terraform_validate_all_offline","args":["platform","isolated_tf_data_dir","lockfile_readonly"],"timeout_seconds":600,"required":true},{"id":"terraform_tests_offline","args":["platform","isolated_tf_data_dir","lockfile_readonly"],"timeout_seconds":600,"required":true},{"id":"cross_module_negative_tests","timeout_seconds":300,"required":true},{"id":"operations_semantics","timeout_seconds":180,"required":true}],
  "terra_attempt_limit":3,"elapsed_limit_minutes":25,"escalation":{"consecutive_failures":2,"same_error_count":2,"no_diff_repairs":1,"scope_escape":true},
  "approval":{"required":false,"gate_id":null,"stage":"post_validation_pre_commit","approver":"human","receipt_path":null,"reason":"Deterministic repo-only integration task; locked design changes still force a human pause."},
  "expected_artifacts":["platform/environments/README.md","platform/docs/validation.md","platform/docs/operations/baseline-runbook.md","platform/docs/operations/cost-and-teardown.md","platform/tests/integration/README.md"],"expected_evidence":"evidence/platform/A-006.json","commit_message":"feat(A-006): compose and validate environments","claims":{"cloud_validated":false,"aws_implemented":false,"azure_implemented":false}
}
