{
  "schema_version":"project-a-task-policy-v1","id":"A-007","title":"Evidence, Azure Government notes, and handoff","risk":"high","mode":"repo_only","depends_on":["A-006"],
  "allowed_paths":["platform/README.md","platform/docs/diagrams/**","platform/docs/azure-government/**","platform/docs/review/**","platform/docs/portfolio/**","platform/evidence-index.md","platform/graphify-out/**"],
  "adapter_owned_paths":["evidence/platform/A-007.json"],"forbidden_operations":["aws","az","terraform apply","terraform destroy","terraform import","terraform plan","cloud claim","credential read"],
  "validator_mutation_policy":"no_tracked_writes","validators":[{"id":"scope","timeout_seconds":30,"required":true},{"id":"credential_boundary","timeout_seconds":30,"required":true},{"id":"forbidden_operations","timeout_seconds":30,"required":true},{"id":"secret_scan","timeout_seconds":60,"required":true},{"id":"required_evidence","timeout_seconds":180,"required":true},{"id":"claims_boundary","timeout_seconds":60,"required":true},{"id":"claim_language_semantics","timeout_seconds":90,"required":true},{"id":"diagram_links","timeout_seconds":120,"required":true},{"id":"graphify_evidence","timeout_seconds":300,"required":true},{"id":"final_repo_validation","timeout_seconds":900,"required":true}],
  "terra_attempt_limit":3,"elapsed_limit_minutes":25,"escalation":{"consecutive_failures":2,"same_error_count":2,"no_diff_repairs":1,"scope_escape":true},
  "approval":{"required":false,"gate_id":null,"stage":"post_validation_pre_commit","approver":"human","receipt_path":null,"reason":"Autonomous repo-only revision; evidence, claims, diagrams, Graphify, and final repository gates own completion."},
  "expected_artifacts":["platform/evidence-index.md","platform/docs/azure-government/readiness.md","platform/docs/review/pushback-and-handoff.md","platform/docs/portfolio/claims-boundary.md","platform/docs/diagrams/aws-landing-zone-architecture.png","platform/graphify-out/GRAPH_REPORT.md"],"expected_evidence":"evidence/platform/A-007.json","commit_message":"feat(A-007): complete evidence and handoff","claims":{"cloud_validated":false,"aws_implemented":false,"azure_implemented":false}
}
