{
  "schema_version":"project-a-task-policy-v1","id":"A-002","title":"Organizations and account baseline","risk":"high","mode":"repo_only","depends_on":["A-001"],
  "allowed_paths":["platform/terraform/organization/**","platform/docs/architecture/accounts.md","platform/docs/guardrails/organizations.md"],
  "adapter_owned_paths":["evidence/platform/A-002.json"],"forbidden_operations":["aws","az","terraform apply","terraform destroy","terraform import","terraform plan","account creation","credential read"],
  "validator_mutation_policy":"no_tracked_writes","validators":[{"id":"scope","timeout_seconds":30,"required":true},{"id":"credential_boundary","timeout_seconds":30,"required":true},{"id":"forbidden_operations","timeout_seconds":30,"required":true},{"id":"secret_scan","timeout_seconds":60,"required":true},{"id":"terraform_fmt_check","args":["platform/terraform/organization"],"timeout_seconds":120,"required":true},{"id":"terraform_validate_offline","args":["platform/terraform/organization","isolated_tf_data_dir","lockfile_readonly"],"timeout_seconds":300,"required":true},{"id":"organizations_semantics","timeout_seconds":120,"required":true}],
  "terra_attempt_limit":3,"elapsed_limit_minutes":25,"escalation":{"consecutive_failures":2,"same_error_count":2,"no_diff_repairs":1,"scope_escape":true},
  "approval":{"required":true,"gate_id":"H1","stage":"post_validation_pre_commit","approver":"human","receipt_path":".harness/runtime/approvals/A-002.json","reason":"Approve OU/account topology, account semantics, and SCP attachment boundaries."},
  "expected_artifacts":["platform/terraform/organization/README.md","platform/docs/architecture/accounts.md","platform/docs/guardrails/organizations.md"],"expected_evidence":"evidence/platform/A-002.json","commit_message":"feat(A-002): add organization baseline","claims":{"cloud_validated":false,"aws_implemented":false,"azure_implemented":false}
}
